{
  "record_id": "CTX-WEB-2026-00184",
  "source_agent": "website_monitor",
  "source_type": "press_release",
  "source_url": "https://www.syr.gov/News/Traffic-Infrastructure-News/Traffic-Infrastructure-2026/2026-10-30-Infrastructure-News-440PM",
  "publication_date": "2026-10-30",
  "capture_date": "2026-10-31T17:15:03Z",
  "title": "DPW to Begin Overnight Leaf and Snow Removal Operations",
  "summary": "The City of Syracuse Department of Public Works will begin overnight leaf and snow removal operations starting November 1, 2026, deploying crews during non-snow periods for leaf collection using new efficient equipment. Mayor Owens and DPW Commissioner Jeremy Robinson emphasized the service's importance for street accessibility and flood prevention while acknowledging resident concerns about noise disruption.",
  "raw_content": null,
  "transcript_ref": null,
  "topic_tags": [
    "announcement",
    "infrastructure",
    "snow-removal",
    "roads-bridges",
    "neighborhood-services",
    "fleet",
    "residents",
    "recurring",
    "hiring"
  ],
  "department_refs": [
    "Department of Public Works"
  ],
  "entity_refs": [
    {
      "name": "Sharon F. Owens",
      "type": "person",
      "canonical_id": "PERSON-SHARON-OWENS"
    },
    {
      "name": "Jeremy Robinson",
      "type": "person",
      "canonical_id": "PERSON-JEREMY-ROBINSON"
    },
    {
      "name": "City of Syracuse",
      "type": "organization",
      "canonical_id": "ORG-SYRACUSE-CITY"
    }
  ],
  "speakers": null,
  "speaker_confidence": null,
  "sentiment": "positive",
  "political_signal": {
    "signal_type": "priority_alignment",
    "description": "Mayor leadership highlighting seasonal infrastructure readiness and workforce capacity as core municipal service commitment; messaging emphasizes resident safety and service quality despite operational challenges.",
    "confidence": "high"
  },
  "freshness_class": "medium",
  "cluster_ids": [],
  "engagement_relevance": [],
  "feedback": null,
  "schema_version": "1.0.0",
  "librarian_version": "1.0.0-auto",
  "processing_notes": [
    "No dollar amounts detected",
    "Press contact: press@syr.gov",
    "Related resource links included (syr.gov/winter, syr.gov/jobs)",
    "Drop-off site location: 1200 Canal Street Extension",
    "New equipment acquisition mentioned (leaf vacuum trailer) but no procurement details provided",
    "CDL hiring initiative referenced as related action item",
    "Enriched by Claude (claude-haiku-4-5-20251001)"
  ],
  "last_relevance_update": null
}