{
  "record_id": "CTX-WEB-2026-00062",
  "source_agent": "website_monitor",
  "source_type": "press_release",
  "source_url": "https://www.syr.gov/News/Traffic-Infrastructure-News/Traffic-Infrastructure-2024/2024-12-28-Infrastructure-News-630PM",
  "publication_date": "2024-12-28",
  "capture_date": "2026-03-22T14:19:50Z",
  "title": "Water Crews Working to Repair Water Main Break on E Washington St",
  "summary": "The City of Syracuse Department of Water is repairing a water main break on the 100 block of East Washington Street, with service disruptions expected until late morning on December 29, 2024. Two street segments will be closed to vehicle traffic during repairs, though sidewalks remain accessible with detours in place.",
  "raw_content": null,
  "transcript_ref": null,
  "topic_tags": [
    "water",
    "infrastructure",
    "announcement",
    "service-requests",
    "construction-staging",
    "roads-bridges",
    "residents"
  ],
  "department_refs": [
    "Department of Water"
  ],
  "entity_refs": [
    {
      "name": "Sharon F. Owens",
      "type": "person",
      "canonical_id": "PERSON-SHARON-OWENS"
    },
    {
      "name": "City of Syracuse Department of Water",
      "type": "organization",
      "canonical_id": "ORG-WATER-DEPT"
    },
    {
      "name": "Office of Communications",
      "type": "organization",
      "canonical_id": "ORG-COMMUNICATIONS"
    }
  ],
  "speakers": null,
  "speaker_confidence": null,
  "sentiment": "procedural",
  "political_signal": null,
  "freshness_class": "medium",
  "cluster_ids": [],
  "engagement_relevance": [],
  "feedback": null,
  "schema_version": "1.0.0",
  "librarian_version": "1.0.0-auto",
  "processing_notes": [
    "Author attribution unknown; Sharon F. Owens referenced only in navigation menu, not article body",
    "No dollar amounts or budget impact specified",
    "Contact information provided: 315-448-8360 for Department of Water inquiries",
    "Geographic specificity: 100 block E Washington St, bounded by S Warren St and S Salina St",
    "Temporal scope: single incident with defined resolution window",
    "Enriched by Claude (claude-haiku-4-5-20251001)"
  ],
  "last_relevance_update": null
}