{
  "record_id": "CTX-COUNCIL-2026-00074",
  "source_agent": "council_transcriber",
  "source_type": "council_segment",
  "source_url": "https://www.youtube.com/watch?v=i9Nn-8_gM4I&t=5045s",
  "publication_date": "2026-03-18",
  "capture_date": "2026-03-21T23:23:18Z",
  "title": "Parkside Commons Lot Sale $45K, SPD Item Confirmation, Assessment Items",
  "summary": "Councilor Monto presents items 49-53. Item 49 ready for Monday. Item 50 (SPD item) confirmed ready by Chief Trudeau. Item 51 -- Michael Layman presents city selling vacant lot at 2016-2024 Fayette St East/Ellis to Parkside Commons for $45,000 (appraised value) for Phase 1 south-side construction. Layman notes title should say 'not less than' $45K to cover recording/title costs. Brief discussion of lot location relative to Parkside development phases -- south side of East Fayette, corner lot at Ellis near former bakery site.",
  "raw_content": "[01:24:05] items 49 through 53. 49 will be ready to\n[01:24:08] go um on Monday.\n[01:24:11] >> Okay.\n[01:24:12] >> Item 50. Chief Trudeell, I talked to\n[01:24:15] Chief Russell this morning and he said\n[01:24:16] we're okay to go with this, but I just\n[01:24:17] want to make sure nothing's changed\n[01:24:18] since 10 o'clock.\n[01:24:19] >> Yes, we're good to go. I'm just\n[01:24:20] appreciate the council's uh cooperation\n[01:24:22] and patience uh with this uh this item.\n[01:24:25] >> Likewise. We appreciate your patience\n[01:24:27] with it, too. So, thank you.\n[01:24:28] >> Thank you.\n[01:24:30] Uh 51\n[01:24:32] that's with that goes with 49, right,\n[01:24:34] Matt? So that one's okay, too.\n[01:24:39] >> Uh 52,\n[01:24:42] >> you're putting it with you. 54. Okay.\n[01:24:45] >> Yeah.\n[01:24:48] >> 51. Councelor.\n[01:24:48] >> Yes. Thank you.\n[01:24:49] >> Thank you. Michael Layman again, deputy\n[01:24:51] commissioner uh with assessments. Uh 51.\n[01:24:54] The city's requesting authorization to\n[01:24:56] enter into a purchase and sale agreement\n[01:24:58] with Parkside Commons for the city-owned\n[01:25:00] property uh at 2016 to 2024 Fat Street\n[01:25:05] East and Ellis Street. It's a vacant lot\n[01:25:08] right now. It was appraised uh for\n[01:25:10] 45,000 which would be the purchase price\n[01:25:12] in the agreement.\n[01:25:14] [snorts]\n[01:25:14] >> It's part of that whole development,\n[01:25:16] right?\n[01:25:16] >> Yes.\n[01:25:16] >> Okay. Okay.\n[01:25:18] >> Any questions on that one?\n[01:25:19] >> So, this is I know exactly a lot. And\n[01:25:22] what do they plan? What do they plan on?\n[01:25:26] Is that part of the construction? Are\n[01:25:27] they just using that?\n[01:25:28] >> I I understand that uh a building would\n[01:25:30] be constructed there to uh supplement\n[01:25:33] where folks can live while they are\n[01:25:35] working on the buildings on the north\n[01:25:36] side of Fyet.\n[01:25:38] >> Oh, I get that. They're they're I\n[01:25:40] understand they're building part that's\n[01:25:42] going to be added on to the construction\n[01:25:46] site that they're already near the\n[01:25:48] store. That lot that we own. Is that\n[01:25:50] added on to this construction bill?\n[01:25:52] >> At least half that question. Um, but I\n[01:25:54] did catch possibly an error in the short\n[01:25:55] title. I'm sorry, counselor.\n[01:25:56] >> So,\n[01:25:58] >> the property that we're selling? Yes. Is\n[01:26:00] that a part of their renderings of the\n[01:26:02] construction site?\n[01:26:03] >> Yeah, that that um phase one south side\n[01:26:06] of East FET, that's part of that larger\n[01:26:07] building at the corner of Ellis on the\n[01:26:09] corner store and then our lot directly\n[01:26:11] to the east on the corner of Ellis.\n[01:26:13] >> Opposite side, right? Uh, no. South\n[01:26:15] across from um across from the current\n[01:26:19] um 1900 or 2,000 block buildings.\n[01:26:23] >> So, so there's the So, there's the\n[01:26:24] taller one um on the hilly corner on the\n[01:26:26] former bakery site. Um this is the other\n[01:26:29] one.\n[01:26:30] >> You're trying to purchase.\n[01:26:31] >> Yeah.\n[01:26:32] >> Okay.\n[01:26:32] >> And I just want to clarify, we've got it\n[01:26:34] not to exceed 45,000 on here. It should\n[01:26:36] exceed 45,000 because it should um\n[01:26:38] include appraised value plus recording\n[01:26:40] and uh title. So, we'll we'll check the\n[01:26:43] draft ordinance and make sure. [snorts]\n[01:26:46] >> Yeah,\n[01:26:46] >> I don't know what you say. I don't know.\n[01:26:48] >> I know short titles.\n[01:26:50] >> Yeah, we charge.\n[01:26:51] >> We'll look.\n[01:26:52] >> 45,000's the floor.\n[01:26:54] >> Thanks, Matt.\n[01:26:56] >> Uh 52.\n[01:26:58] >> Yeah,\n[01:27:02] >> Jake.\n[01:27:04] >> Good afternoon, council. Jake Dishaw,\n[01:27:06] deputy commissioner of code enforcement",
  "transcript_ref": "outputs/transcripts/i9Nn-8_gM4I_corrected.txt",
  "topic_tags": [
    "housing",
    "land-use",
    "police",
    "council"
  ],
  "department_refs": [
    "Department of Assessment",
    "Syracuse Police Department"
  ],
  "entity_refs": [
    {
      "name": "Jimmy Monto",
      "type": "person",
      "canonical_id": "PERSON-MONTO-COUNCIL"
    },
    {
      "name": "Patrona Jones-Rowser",
      "type": "person",
      "canonical_id": "PERSON-JONES-ROWSER-COUNCIL"
    },
    {
      "name": "Michael Layman",
      "type": "person",
      "canonical_id": "PERSON-LAYMAN-ASSESSMENT"
    },
    {
      "name": "Parkside Commons",
      "type": "organization"
    }
  ],
  "speakers": [
    {
      "name": "Jimmy Monto",
      "role": "Councilor, District 5",
      "confidence": "high"
    },
    {
      "name": "Michael Layman",
      "role": "Deputy Commissioner, Assessment",
      "confidence": "high"
    },
    {
      "name": "Rich Trudeau",
      "role": "SPD First Deputy Chief",
      "confidence": "medium"
    },
    {
      "name": "Patrona Jones-Rowser",
      "role": "Councilor, District 4",
      "confidence": "medium"
    }
  ],
  "speaker_confidence": "medium",
  "sentiment": "procedural",
  "political_signal": null,
  "freshness_class": "long",
  "cluster_ids": [
    "CLUSTER-PARKSIDE-COMMONS-2026Q1"
  ],
  "engagement_relevance": [],
  "feedback": null,
  "schema_version": "1.0.0",
  "librarian_version": "1.0.0",
  "processing_notes": [
    "Parkside Commons Phase 1 south side of East Fayette -- corner lot at Ellis St. 'Not to exceed $45K' should be 'not less than $45K' per Layman's correction to cover recording and title costs. Department of Permits and Development detection is from code enforcement deputy commissioner appearing at end of segment for next item.",
    "Semi-automated: draft_records.py extraction + Claude enrichment",
    "Segment 22 of 23 from Common Council Study Session, Wednesday March 18th 2026",
    "Transcript corrections applied: CNS -> CNS Engineers; SU -> Syracuse University",
    "Potential duplicate detected: overlaps with CTX-COUNCIL-2026-00072 -- linked, not skipped"
  ],
  "last_relevance_update": null
}
